Question,Attribute name,Intelligence,Learning,Decision-making,Creativity,Memory
What is the typical purpose of X?,purpose,To process information and make decisions,To acquire knowledge or skills through study or experience,To choose between alternatives or courses of action,To generate novel and valuable ideas or solutions,To retain and recall information or experiences
How is X commonly measured or assessed?,measurement,"IQ tests, standardized tests, problem-solving tasks","Exams, practical tests, observations","Analysis of outcomes, decision trees, judgment analysis","Creativity tests, peer reviews, impact of work","Memory tests, recall exercises, recognition tasks"
What are common tools or methods to enhance X?,enhancement methods,"Educational activities, puzzles, brain training","Educational courses, practice, mentoring","Decision-making frameworks, pros and cons lists","Brainstorming, exposure to diverse experiences, practice","Mnemonic devices, repetition, healthy lifestyle"
What are typical outcomes or effects of X?,outcomes,"Better problem-solving, adaptability, understanding","Increased knowledge, skill proficiency, adaptability","Effective choices, problem resolution, goal achievement","Innovation, unique solutions, artistic expression","Recollection of past, learning efficiency, knowledge application"
Can X be significantly improved or developed?,improvability,"Yes, through learning and experience","Yes, through practice and exposure","Yes, with experience and knowledge","Yes, through practice and inspiration","Yes, with techniques and healthy practices"
Is X influenced by external factors?,external influence,"Yes, by education, environment, and experiences","Yes, by teaching methods, environment, and resources","Yes, by available information, biases, and social influences","Yes, by environment, culture, and education","Yes, affected by age, health, and environmental factors"
Is X considered innate or learned?,innate or learned,Both innate and developed over time,"Primarily learned, though innate abilities can influence it","Learned skill, though some innate intuition may be involved",Both innate talent and developed skill,Both innate capacity and developed through practice
What are common challenges or difficulties associated with X?,challenges,"Varies depending on the individual, can include learning disabilities","Retention, understanding complex concepts, motivation","Indecision, biased judgments, lack of information","Creative blocks, originality, societal acceptance","Forgetting, distortions, information overload"
How does X impact daily life or activities?,daily impact,"Influences learning, problem-solving, and adaptation skills",Affects ability to acquire new skills and adapt,Critical for personal and professional choices,Enables problem-solving and artistic expression,Essential for learning and daily functioning
What fields or disciplines heavily rely on X?,field relevance,"Psychology, education, artificial intelligence","Education, training, personal development","Business, management, psychology","Arts, design, innovation, problem-solving","Psychology, education, neuroscience"
What is the typical age of development for X?,age of development,"Develops early in childhood, evolves over time","Lifelong, with rapid development in early years","Develops in adolescence, matures in adulthood",No specific age; can be nurtured at any age,"Develops early, peak in young adulthood"
Are there known historical figures noted for X?,historical figures,"Einstein, Da Vinci, Marie Curie","Socrates, Maria Montessori, Piaget","Historical leaders like Churchill, decision theorists","Da Vinci, Picasso, Mozart",Mnemonists like Solomon Shereshevsky
What are common misconceptions about X?,misconceptions,That it is fixed and solely genetic,That it stops after formal education,That it's always rational or devoid of emotion,That only artistic people are creative,That it's infallible and always accurate
How does X vary across cultures?,cultural variation,Varies in definition and value placed on it,Diverse educational systems and learning styles,Different decision-making styles and processes,"Varies in expression, art forms, and value",Differences in mnemonic techniques and importance
What technological advancements are related to X?,technological relevance,"AI, cognitive computing, intelligent systems","E-learning platforms, educational software","Data analytics, decision support systems","Digital art tools, creative software","Memory-enhancing drugs, digital storage as external memory"
How does X influence personal relationships?,influence on relationships,Affects understanding and empathy in relationships,Facilitates communication and mutual understanding,"Plays a role in resolving conflicts, building trust",Enhances expression and emotional connection,Affects shared experiences and understanding
What are the ethical considerations related to X?,ethical considerations,"Biases in intelligence testing, AI ethics","Access to education, learning styles diversity","Moral dilemmas, bias in decision-making","Intellectual property rights, cultural appropriation","Issues around memory manipulation, privacy"
How does X contribute to professional success?,contribution to success,Critical for problem-solving and adaptability,Key for continuous personal and professional growth,Essential for leadership and strategic planning,Drives innovation and original solutions,Important for expertise and efficiency
What psychological theories are related to X?,related theories,"Multiple intelligences, IQ theory","Behaviorism, constructivism, cognitive development","Rational choice theory, behavioral economics","Right-brain dominance theory, flow state","Cognitive psychology, neurobiology of memory"
How is X represented in popular media?,representation in media,"Often associated with genius, depicted in characters like Sherlock Holmes","Shown as a journey or transformation, e.g., in documentaries","Featured in game shows, business scenarios in films",Often romanticized in stories of artists and inventors,"Depicted in films about amnesia, memoirs"
What historical figures are known for exceptional X?,historical figures,"Albert Einstein, Isaac Newton, Marie Curie","Socrates, Leonardo da Vinci, Helen Keller","Steve Jobs, Ruth Bader Ginsburg, Nelson Mandela","Leonardo da Vinci, Frida Kahlo, Wolfgang Amadeus Mozart","Hippocrates, Ibn Sina (Avicenna), Sigmund Freud"
What are typical misconceptions about X?,misconceptions,That it's fixed and solely based on genetics,That learning stops after formal education,That it's always a rational or conscious process,That it's only related to arts and cannot be learned,That memory is infallible and always accurate
How does X vary across different cultures or societies?,cultural variation,Varies in the value and interpretation of intelligence,Different educational systems and approaches,Cultural norms influence decision-making styles,Different artistic and creative expressions in various cultures,Memory techniques and importance vary across cultures
What are the biological or neurological bases of X?,biological basis,"Brain structures like the prefrontal cortex, neurotransmitters","Neuroplasticity, synaptic connections in the brain","Prefrontal cortex involvement, neurotransmitter influences","Right brain dominance theory, neural networks for creative thinking","Hippocampus involvement, neural pathways, neurotransmitters"
How does X change with age?,age-related changes,"Generally stable, but can be affected by health and lifestyle","Increases in early life, can slow but continues throughout life","Improves with age and experience, though speed may decrease","Often peaks in young adulthood, but can persist or even grow","Develops in early years, peaks in mid-life, often declines with age"
What are the ethical concerns or debates related to X?,ethical concerns,Issues around intelligence testing and its applications,"Access to education, teaching methods, educational equity","Moral and ethical decision-making, impact of AI on decision-making","Intellectual property rights, originality vs. inspiration","Concerns about memory-enhancing drugs, privacy in memory research"
How is X portrayed or represented in media and literature?,media representation,Often portrayed as a key trait of successful and influential characters,Often depicted as a lifelong journey or transformative process,Frequently featured in narratives involving moral dilemmas,"Glorified in media as a trait of complex, often tortured characters","Often used as a plot device in storytelling, showing flashbacks or amnesia"
What are the professional or career implications of X?,career implications,Critical in fields requiring problem-solving and analytical skills,"Essential in all professions, especially in educational and training roles","Key in leadership, management, and strategic planning roles","Valuable in design, arts, innovation, and problem-solving professions","Important in roles requiring recall of information, like academia or law"
How does X interact with other cognitive functions?,interaction with other functions,"Interacts with memory, attention, and learning processes","Interacts with memory, attention, and cognitive development","Works in tandem with emotion, reasoning, and risk assessment","Interacts with intelligence, imagination, and problem-solving","Interacts with learning, attention, and cognitive processing"
What are the potential disorders or dysfunctions related to X?,related disorders,"Dysfunctions like intellectual disability, cognitive decline","Learning disorders like dyslexia, ADHD","Issues like decision-making impairments, impulsivity disorders","Creative blocks, mental health issues like bipolar disorder","Memory impairments like Alzheimer's disease, amnesia"
